Don Clemente Autentica Loteria Mexican Bingo Set 20 Tablets Colorful and Educational,7.20 €
"UNO Minecraft Card Game Videogame-Themed Collectors Deck 112 Cards With Character Images, Gift For Fans Ages 7 Years Old & Up",7.49 €
"YoYa Toys Beadeez Squishy Stress Relief Balls (3 Pack) - Colorful Squeeze Stretch Balls with Water Beads - Sensory Fidget Toys for Kids and Adults - Increase Focus, Great for ADHD, Autism, Anxiety",15.99 €
UNO Card Game (2 Pack),9.22 €
"Twister Ultimate: Bigger Mat, More Colored Spots, Family, Kids Party Game Age 6+; Compatible with Alexa (Amazon Exclusive)",21.93 €
FITZ - ¡Dios Mio! Bilingual Fun Card Game - Juegos de mesa en español - A Comedy Party Tarjeta Game NSFW - 350 Muy Graciosa Cards - Spanish Board Game - Party Games,24.99 €
"Elite Sportz Ring Toss Games for Kids - Outdoor Yard Game for Adults & Family - Backyard Toys, Outdoor Games, Yard Games, Backyard Games, Lawn Games, Outdoor Toys For Kids Ages 4-8, Outdoor Toys",19.61 €
USAOPOLY TAPPLE® Word Game | Fast-Paced Family Board Game | Choose a Category & Race Against The Timer to be The Last Player | Learning Game Great for All Ages,16.99 €
"Regal Games - Reversible Wooden Board for Chess, Checkers & Tic-Tac-Toe - 24 Interlocking Wooden Checkers and 32 Standard Chess Pieces - for Age 8 to Adult for Family Fun",22.99 €
IJO Double Sided Dart Board 29 inch with 12 Sticky Balls-Boys Girls Toys-Indoor/Outdoor Target Game-Party Games for 3 4 5 6 7 8 9 10 11 12 Years Old Boys Girls Childrens,11.99 €
"ERLLE Dominos Set Game. Premium Classic 55 Color Pieces Double Nine Domino. Durable tin Box. Kids, Boys, Girls, Party Favors and Anytime use. Duoble 9 Dominoes.",11.99 €
"Twister Party Classic Board Game for 2 or More Players, Indoor and Outdoor Game for Kids 6 and Up, Packaging may vary",17.97 €
"Conversation Game in Spanish - Why Don't We - Conversar y Conocerse - 120 Cards with Questions, Games, Conversations & More. Fun Game for Adults and Gift for Couples.",22.90 €
"The Game of Life: Super Mario Edition Board Game for Kids Ages 8 and Up, Play Minigames, Collect Stars, Battle Bowser",24.99 €
"Hedbanz Picture Guessing Board Game New Edition, for Families and Kids Ages 8 and up",13.99 €
"Wireless Retro Game Console,Retro Game Stick,Nostalgia Stick Game,4K HDMI Output,Plug and Play Video Game Stick Built in 10000+ Games,9 Classic Emulators, with Dual 2.4G Wireless Controllers(64G)",54.99 €
Classic 6 Game Collection,15.10 €
"Skillmatics Educational Game - I Can Write, Reusable Activity Mats with 2 Dry Erase Markers, Gifts for Ages 3 to 6",
"Tragos En Español Game for Latinos - Relatable Hilarious Cultural Spanglish Card Game - Gift for Adults, College Students, Families &amp; Party Animals - Juegos De Mesa para Adultos",22.99 €
"Squid Toys Action Figures Building Kit, Popular TV Building Sets, with 6 Cute Characters, Collectible Model, Valentines Day Gifts for Kids or Friends (436 Pieces)",13.98 €
"Baby Shower Loteria Bingo in Spanish, for 20 Players",14.10 €
Hasbro Gaming Jenga Wooden Blocks Stacking Tumbling Tower Kids Game Ages 6 and Up (Amazon Exclusive),16.99 €
"Melissa & Doug Suspend Family Game (31 pcs) - Wire Balance Game, Family Game Night Activities, For Kids Ages 8+",18.99 €
PADONISE Soft Animal Wrist Rattles Foot Finder Socks Baby Toy Set Cotton Plush Stuffed Animal Toys Car Charm Crib Stroller Soothing Toys for Newborn Gift for Infant Baby 0-3-6-12-24-48 Months,9.99 €
"ELCOHO 12 Toss and Catch Sport Game Set Including 12 Toss & Catch Paddles and 12 Toss and Catch Balls (6 Hard Balls and 6 Soft Balls) with Storage Bag for Sport, Beach, Party Favor and Supplies",25.99 €
Hooomyai 24 Inch Prize Wheel with Folding Tripod Floor Stand Height Adjustable 14 Slots Color Dry Erase Spin Wheel Spinner Game with Dry Erase & Marker Pen for Trade Show Fortune Spinning Game,95.99 €
"XQW 3 in 1 Classic Board Games Set for Kids Adults and Families with 12.5"" Foldable Game Board,Magnetic Travel Board Game Set,Including Ludo,Snakes and Ladders Board Game,Chinese Checkers",19.99 €
El Juego Perfecto (The Perfect Game) Audio English & Spanish with Spanish Subtitles,19.99 €
"Connect 4 Classic Grid , 4 in a Row Game, Strategy Board Games for Kids, 2 Player . for Family and Kids, Ages 6 and Up",5.48 €
"Jenga Classic Game with Genuine Hardwood Blocks, Stacking Tower Game for 1 or More Players, Kids Ages 6 and Up",12.38 €
Zygomatic Spot It! Classic Card Game (Pocket Edition) | Matching Game | Fun Kids Game for Family Game Night | Travel Game | Great Kids Gift | Ages 6+ | 2-8 Players | Avg. Playtime 15 Mins | Made,5.99 €
DFGEE Baby Montessori Toys Dinosaur Games Toddler Sensory Fine Motor Skills Learning Educational Activities Outdoor Developmental Toys Gifts for 18 Month Age 2 3 4 One Two Year Old Boys Girls Kids,5.99 €
"TOSY Patented Boomerang - 3 Super Bright LEDs, Rechargeable, Auto Light Up, Launcher & Flying Disc/Frisbee Included, Perfect Outdoor Games, Birthday & Camping Gift for Men/Boys/Teens/Kids",79.99 €
Makedo Starter 036 | Cardboard Construction Starter Pack | STEM and STEAM Educational Toys for Kids | Perfect for at Home Play + Classroom Learning | 36 Piece Mix SCRU & SCRU+ for Kids Age 4+,10.00 €
"Incredibly Interconnectable Toys KADU DA Seaside Splash 226 Piece Set - STEM/STEAM Building + Construction Toy, for Open + Imaginative Play",39.99 €
"yeesport Sport Stacking Cups, 24pcs Sports Stacking Cups Speed Training Game for Challenge Competition Travel Party Gift for Kids and Adults (Purple & Red)",17.97 €
Classic Operation Game,14.99 €
"UNO - Classic Colour & Number Matching Card Game - 112 Cards - Customizable & Erasable Wild - Special Action Cards Included - Gift for Kids 7+, W2087",6.00 €
"Vango The UpsideDownChallenge Game for Family & Kids - Complete Fun Challenges with Upside Down Goggles - Hilarious Fun Game for Game Night & Parties - 2-6 Players, Ages 8+",19.72 €
Late for the Sky Mexico-opoly,20.99 €
"Super Slide Puzzle Games with 1500+ Challenges, Sliding Puzzle Game for Kids and Teens, Travel Games Birthday for Boys Girls, STEM Brain Teaser Puzzle for All Ages(Pink)",39.99 €
"QBDIANGEN Shape Matching Game Color Sensory Educational Toy with Scoreboard, Bell and Cards Montessori Toddler Sensory Board Wooden Montessori Puzzles Shape for Ages 3 & Up Children (for 2 Players)",27.99 €
"Ring Hook Toss Game, Hook and Ring Tossing Toy with Shot Ladder, Handmade Wooden Interactive Games for Bars, Home and Party Fun",25.99 €
"JOYPRO Wooden 4 in a Row Connect Game, Foldable Board Line Up 4 Connect Game, Family Picnic Camping Party Travel Classic Board Game Toys for Christmas Kids Gifts (Travel Size: 9.5"" x 6.0"" x 6.5"")",13.99 €
"Amerous 10"" Ludo Go Board Folding Travel Magnetic Ludo Set",10.99 €
"Regal Games - Deluxe Bingo Set - Includes Bingo Cage, Master Board, 18 Mixed Cards, 75 Calling Balls, Colorful Chips - Ideal for Large Groups, Parties",19.99 €
JA-RU Rainbow Jax Toy Set (2 Pack) Big Plastic Jacks Game with Ball for Kids and Adults. Neon Colored Toy Jacks. Fun Vintage Retro Toy. Stocking Stuffers Party Favor Birthday Gifts Bulk. 731-2s,7.98 €
"Anbalulu Magnetic Tiles for Kids, Stacking Blocks, Preschool Stem Construction Building Set 100 Pcs",49.99 €
"Hasbro Gaming Pictureka! Picture Hunt Game Spanish Version, Find it Fast Shout Out First",12.99 €
Lutron Pico Smart Remote Control for Caséta Smart Dimmer Switch | PJ2-3BRL-WH-L01R | White,19.95 €
"ZeeDix 90pcs Pick Up Sticks with 3 Sets Retro Metal Jacks Kit- Include 3 Pieces Red Rubber Balls and 30 Pieces Gold and Silver Metal Jacks, Classic Fun Game Gift of Jacks for Kids Adults Family",12.99 €
Kids Dart Board Game Set-14 Inches Dart Board for Kids with 12 Sticky Balls - Indoor and Outdoor Activities Game for Kids- Safe Darts Board Game Gift Toy for 3 4 5 6 7 8-12 Years Old Kids Boys Girls,8.99 €
"SpriteGru Memory Matching Game, 72 PCS Animal Matching Cards for Toddlers 36 Pairs Memory Cards for Preschool 4 5 6 Years Old",9.99 €
Hxezoc Pin The Tail On The Donkey Party Game With 50 Pcs Tails Large Mexican Donkey Games Poster for Kids Birthday Party Carnival Fiesta Party Supplies,5.99 €
"UNO Card Game for Family Night, Travel Game & Gift for Kids In a Collectible Storage Tin for 2-10 Players [Amazon Exclusive]",10.87 €
"Pressman Toy Pahrcheesi in Box, Red, 5""",9.99 €
"20PCS Outdoor Games Potato Sack Race Bag, 3-Legged Race Bands, with Egg and Spoon Race Lawn Games for Outside Backyard Field Day Birthday Party Games for Kids and Adults.",19.99 €
"KlayBear Jacks Game with Ball, Retro Vintage Jax Game for Kids and Adults, Classic Board Games with 18 Metal Jacks & 3 Red Rubber Balls, Old Fashion Traditional Table Games for Family Game Night",12.99 €
QianDanS Wooden Puzzle Wooden Pattern Blocks Set Educational Montessori Toys with Design Cards Kids Rainbow Stacking Blocks Kindergarten Toddler Building Toys for Toddlers Babies Age 3-8,34.99 €
EVERICH TOY Beach Toys Outdoor Games for Kids Ages 3-10-Yard Lawn Games Ball Catch Games Paddle Toss-Upgraded Version Outside Games for Kids/Family Boys and Girls Gifts,25.99 €
